Sheet: Sample Data
A1: Test String 1 | B1: 1 | C1: 5 | E1: A | F1: E | H1: of:=[.B1]+[.C1] -> 6 | J1: of:=[.E1]&[.F1] -> AE | L1: PhpSpreadsheet
A2: Test - String 2 | B2: 2 | C2: 6 | E2: B | F2: F | H2: of:=[.B2]+[.C2] -> 8 | J2: of:=[.E2]&[.F2] -> BF | N2: Dot
A3: Test #3 | B3: 3 | C3: 7 | E3: C | F3: G | H3: of:=[.B3]+[.C3] -> 10 | J3: of:=[.E3]&[.F3] -> CG | K3: Red | L3: Red | N3: Dash
A4: Test with (") in string | B4: 4 | C4: 8 | E4: D | F4: H | H4: of:=[.B4]+[.C4] -> 12 | J4: of:=[.E4]&[.F4] -> DH | K4: Orange | L4: Orange | N4: Dash/Dot/Dot
H5: of:=SUM([.B1:.B4]) -> 10 | I5: of:=SUM([.C1:.C4]) -> 26 | J5: of:=SUM([.B1:.C4]) -> 36 | K5: Yellow | L5: Yellow | N5: Dash/Dot
A6: Test #3 | B6: 1.23 | C6: of:=TRUE() -> 1 | D6: 1 | K6: Green | L6: Green | N6: Thin Line
A7: Test #3 | B7: 2.34 | C7: of:=FALSE() -> 0 | D7: 0 | H7: of:=SUM(marksrange) -> 0 | K7: Blue | L7: Blue | N7: Thick Dash/Dot/Dot
A8: Test #3 | B8: 3.45 | K8: Purple | L8: Purple | N8: Variant Thick Dash/Dot/Dot
K9: Pink | L9: Pink | N9: Thick Dash/Dot
A10: 1960-12-19T00:00:00.000 | C10: TOP | G10: 0 | K10: Brown | L10: Brown | N10: Thick Dash
A11: 1.5 | G11: of:=12/0 -> 0 | N11: Thick Line
C12: BOTTOM | N12: Extra Thick Line
A13: 1899-12-31T02:30:00.000 | F13: Мойва сушеная | N13: Double Line
C14: LEFT | F14: Ärendetext
A15: 1960-12-19T01:30:00.000 | F15: Højde
C16: RIGHT
B18: BOX | G18: Test Column 1
F19: Test Column 2 | I19: Patterned | J19: Patterned 2
I20: Test Column 3
A22: Underline None | C22: Rotate 90 | E22: Rotate 45 | G22: Rotate -90 | I22: Rotate -45
A23: Underline 1 | B23: Subscript
A24: Underline 2 | B24: Superscript
A25: Underline 3
A26: Underline 4
A28: I don't know if Gnumeric supports Rich Text in the same way as Excel , And this row should be autofit height with text wrap
A29: PhpSpreadsheet

Sheet: Report Data
A2: Heading 1 | B2: Heading 2 | C2: Third Heading | D2: Date Heading | E2: Time Heading | G2: Adjusted Date | H2: Adjusted Number
B3: Adjusted Number | C3: Third Heading
A4: 1 | B4: 1.11 | C4: 1.11
A5: 2 | B5: 4.44 | C5: 2.22
A6: 3 | B6: 9.99 | C6: 3.33
A7: 4 | B7: 17.76 | C7: 4.44
A8: 5 | B8: 27.75 | C8: 5.55
A9: 6 | B9: 39.96 | C9: 6.66
A10: 7 | B10: 54.39 | C10: 7.77
A11: 8 | B11: 71.04 | C11: 8.88
A12: 9 | B12: 89.91 | C12: 9.99
A13: 10 | B13: 111 | C13: 11.1
A14: 11 | B14: 134.31 | C14: 12.21
A15: 12 | B15: 159.84 | C15: 13.32
A16: 13 | B16: 1.11 | C16: -1.11
A17: ABC | B17: 1 | C17: 1.11 | D17: 2001-01-01T00:00:00.000 | E17: 1899-12-31T01:00:00.000 | G17: of:=[.D3]-[.B3] -> 2000-12-31T00:00:00.000 | H17: of:=[.B3]*[.C3] -> 1.11 | J17: A | K17: of:=[.B3]&[.J3] -> 1A
A18: BCD | B18: 2 | C18: 2.22 | D18: 2002-02-02T00:00:00.000 | E18: 1899-12-31T02:00:00.000 | G18: of:=[.D4]-[.B4] -> 2002-01-31T00:00:00.000 | H18: of:=[.B4]*[.C4] -> 4.44 | J18: B | K18: of:=[.B4]&[.J4] -> 2B
A19: CDE | B19: 3 | C19: 3.33 | D19: 2003-03-03T00:00:00.000 | E19: 1899-12-31T03:00:00.000 | G19: of:=[.D5]-[.B5] -> 2003-02-28T00:00:00.000 | H19: of:=[.B5]*[.C5] -> 9.99 | J19: C | K19: of:=[.B5]&[.J5] -> 3C
A20: DEF | B20: 4 | C20: 4.44 | D20: 2004-04-03T23:00:00.000 | E20: 1899-12-31T04:00:00.000 | G20: of:=[.D6]-[.B6] -> 2004-03-30T23:00:00.000 | H20: of:=[.B6]*[.C6] -> 17.76 | J20: D | K20: of:=[.B6]&[.J6] -> 4D
A21: EFG | B21: 5 | C21: 5.55 | D21: 2005-05-04T23:00:00.000 | E21: 1899-12-31T05:00:00.000 | G21: of:=[.D7]-[.B7] -> 2005-04-29T23:00:00.000 | H21: of:=[.B7]*[.C7] -> 27.75 | J21: E | K21: of:=[.B7]&[.J7] -> 5E
A22: FGH | B22: 6 | C22: 6.66 | D22: 2006-06-05T23:00:00.000 | E22: 1899-12-31T06:00:00.000 | G22: of:=[.D8]-[.B8] -> 2006-05-30T23:00:00.000 | H22: of:=[.B8]*[.C8] -> 39.96 | J22: F | K22: of:=[.B8]&[.J8] -> 6F
A23: GHI | B23: 7 | C23: 7.77 | D23: 2007-07-06T23:00:00.000 | E23: 1899-12-31T07:00:00.000 | G23: of:=[.D9]-[.B9] -> 2007-06-29T23:00:00.000 | H23: of:=[.B9]*[.C9] -> 54.39 | J23: G | K23: of:=[.B9]&[.J9] -> 7G
A24: HIJ | B24: 8 | C24: 8.88 | D24: 2008-08-07T23:00:00.000 | E24: 1899-12-31T08:00:00.000 | G24: of:=[.D10]-[.B10] -> 2008-07-30T23:00:00.000 | H24: of:=[.B10]*[.C10] -> 71.04 | J24: H | K24: of:=[.B10]&[.J10] -> 8H
A25: IJK | B25: 9 | C25: 9.99 | D25: 2009-09-08T23:00:00.000 | E25: 1899-12-31T09:00:00.000 | G25: of:=[.D11]-[.B11] -> 2009-08-30T23:00:00.000 | H25: of:=[.B11]*[.C11] -> 89.91 | J25: I | K25: of:=[.B11]&[.J11] -> 9I
A26: JKL | B26: 10 | C26: 11.1 | D26: 2010-10-09T23:00:00.000 | E26: 1899-12-31T10:00:00.000 | G26: of:=[.D12]-[.B12] -> 2010-09-29T23:00:00.000 | H26: of:=[.B12]*[.C12] -> 111 | J26: J | K26: of:=[.B12]&[.J12] -> 10J
A27: KLM | B27: 11 | C27: 12.21 | D27: 2011-11-11T00:00:00.000 | E27: 1899-12-31T11:00:00.000 | G27: of:=[.D13]-[.B13] -> 2011-10-31T00:00:00.000 | H27: of:=[.B13]*[.C13] -> 134.31 | J27: K | K27: of:=[.B13]&[.J13] -> 11K
A28: LMN | B28: 12 | C28: 13.32 | D28: 2012-12-12T00:00:00.000 | E28: 1899-12-31T288:00:00.000 | G28: of:=[.D14]-[.B14] -> 2012-11-30T00:00:00.000 | H28: of:=[.B14]*[.C14] -> 159.84 | J28: L | K28: of:=[.B14]&[.J14] -> 12L
A29: ZYX | B29: -1 | C29: -1.11 | D29: 1999-12-01T00:00:00.000 | E29: 1899-12-31T23:00:00.000 | G29: of:=[.D15]-[.B15] -> 1999-12-02T00:00:00.000 | H29: of:=[.B15]*[.C15] -> 1.11 | J29: M | K29: of:=[.B15]&[.J15] -> -1M