Sheet: Sample Data
A1: Test String 1 | B1: 1 | C1: 5 | E1: A | F1: E | H1: =RC[-6]+RC[-5] -> 6 | J1: =RC[-5]&RC[-4] -> AE
A2: Test - String 2 | B2: 2 | C2: 6 | E2: B | F2: F | H2: =RC[-6]+RC[-5] -> 8 | J2: =RC[-5]&RC[-4] -> BF | N2: Dot
A3: Test #3 | B3: 3 | C3: 7 | E3: C | F3: G | H3: =RC[-6]+RC[-5] -> 10 | J3: =RC[-5]&RC[-4] -> CG | K3: Red | L3: Red | N3: Dash
A4: Test with (") in string | B4: 4 | C4: 8 | E4: D | F4: H | H4: =RC[-6]+RC[-5] -> 12 | J4: =RC[-5]&RC[-4] -> DH | K4: Orange | L4: Orange | N4: Dash/Dot/Dot
H5: =SUM(R[-4]C[-6]:R[-1]C[-6]) -> 10 | I5: =SUM(R[-4]C[-6]:R[-1]C[-6]) -> 26 | J5: =SUM(R[-4]C[-8]:R[-1]C[-7]) -> 36 | K5: Yellow | L5: Yellow | N5: Dash/Dot
A6: Test #3 | B6: 1.23 | C6: =TRUE() -> 1 | D6: 1 | H6: =SUM(R[-1]C+R[-2]C) -> 22 | K6: Green | L6: Green | N6: Thin Line
A7: Test #3 | B7: 2.34 | C7: =FALSE() -> 0 | D7: 0 | H7: =SUM(MarksRange) -> 36 | K7: Blue | L7: Blue | N7: Thick Dash/Dot/Dot
A8: Test #3 | B8: 3.45 | K8: Purple | L8: Purple | N8: Variant Thick Dash/Dot/Dot
K9: Pink | L9: Pink | N9: Thick Dash/Dot
A10: 1960-12-19T00:00:00.000 | C10: TOP | G10: 0 | K10: Brown | L10: Brown | N10: Thick Dash
A11: 1.5 | G11: =12/0 -> #DIV/0! | N11: Thick Line
C12: BOTTOM | N12: Extra Thick Line
A13: 1899-12-31T02:30:00.000 | F13: Мойва сушеная | N13: Double Line
C14: LEFT | F14: Ärendetext
A15: 1960-12-19T01:30:00.000 | F15: Højde
C16: RIGHT
B18: BOX | G18: Test Column 1
H19: Test Column 2 | K19: Patterned | L19: Patterned 2
I20: Test Column 3
A21: PhpSpreadsheet
A22: Underline None | C22: Rotate 90 | E22: Rotate 45 | G22: Rotate -90 | I22: Rotate -45
A23: Underline 1 | B23: Subscript
A24: Underline 2 | B24: Superscript
A25: Underline 3
A26: Underline 4
A28: I don't know if Gnumeric supports Rich Text in the same way as Excel, And this row should be autofit height with text wrap
A29: Blue with underline
A30: 5 | B30: =goodname -> 5 | C30: =@badname -> #NAME?
A31: Hidden row above

Sheet: Report Data
A2: Heading 1 | B2: Heading 2 | C2: Third Heading | D2: Date Heading | E2: Time Heading | G2: Adjusted Date | H2: Adjusted Number
A3: ABC | B3: 1 | C3: 1.1100000000000001 | D3: 2001-01-01T00:00:00.000 | E3: 1899-12-31T01:00:00.000 | G3: =RC[-3]-RC[-5] -> 2000-12-31T00:00:00.000 | H3: =RC[-6]*RC[-5] -> 1.1100000000000001 | J3: A | K3: =RC[-9]&RC[-1] -> 1A
A4: BCD | B4: 2 | C4: 2.2200000000000002 | D4: 2002-02-02T00:00:00.000 | E4: 1899-12-31T02:00:00.000 | G4: =RC[-3]-RC[-5] -> 2002-01-31T00:00:00.000 | H4: =RC[-6]*RC[-5] -> 4.4400000000000004 | J4: B | K4: =RC[-9]&RC[-1] -> 2B
A5: CDE | B5: 3 | C5: 3.33 | D5: 2003-03-03T00:00:00.000 | E5: 1899-12-31T03:00:00.000 | G5: =RC[-3]-RC[-5] -> 2003-02-28T00:00:00.000 | H5: =RC[-6]*RC[-5] -> 9.99 | J5: C | K5: =RC[-9]&RC[-1] -> 3C
A6: DEF | B6: 4 | C6: 4.4400000000000004 | D6: 2004-04-03T23:00:00.000 | E6: 1899-12-31T04:00:00.000 | G6: =RC[-3]-RC[-5] -> 2004-03-30T23:00:00.000 | H6: =RC[-6]*RC[-5] -> 17.760000000000002 | J6: D | K6: =RC[-9]&RC[-1] -> 4D
A7: EFG | B7: 5 | C7: 5.55 | D7: 2005-05-04T23:00:00.000 | E7: 1899-12-31T05:00:00.000 | G7: =RC[-3]-RC[-5] -> 2005-04-29T23:00:00.000 | H7: =RC[-6]*RC[-5] -> 27.75 | J7: E | K7: =RC[-9]&RC[-1] -> 5E
A8: FGH | B8: 6 | C8: 6.66 | D8: 2006-06-05T23:00:00.000 | E8: 1899-12-31T06:00:00.000 | G8: =RC[-3]-RC[-5] -> 2006-05-30T23:00:00.000 | H8: =RC[-6]*RC[-5] -> 39.96 | J8: F | K8: =RC[-9]&RC[-1] -> 6F
A9: GHI | B9: 7 | C9: 7.77 | D9: 2007-07-06T23:00:00.000 | E9: 1899-12-31T07:00:00.000 | G9: =RC[-3]-RC[-5] -> 2007-06-29T23:00:00.000 | H9: =RC[-6]*RC[-5] -> 54.39 | J9: G | K9: =RC[-9]&RC[-1] -> 7G
A10: HIJ | B10: 8 | C10: 8.8800000000000008 | D10: 2008-08-07T23:00:00.000 | E10: 1899-12-31T08:00:00.000 | G10: =RC[-3]-RC[-5] -> 2008-07-30T23:00:00.000 | H10: =RC[-6]*RC[-5] -> 71.040000000000006 | J10: H | K10: =RC[-9]&RC[-1] -> 8H
A11: IJK | B11: 9 | C11: 9.99 | D11: 2009-09-08T23:00:00.000 | E11: 1899-12-31T09:00:00.000 | G11: =RC[-3]-RC[-5] -> 2009-08-30T23:00:00.000 | H11: =RC[-6]*RC[-5] -> 89.91 | J11: I | K11: =RC[-9]&RC[-1] -> 9I
A12: JKL | B12: 10 | C12: 11.1 | D12: 2010-10-09T23:00:00.000 | E12: 1899-12-31T10:00:00.000 | G12: =RC[-3]-RC[-5] -> 2010-09-29T23:00:00.000 | H12: =RC[-6]*RC[-5] -> 111 | J12: J | K12: =RC[-9]&RC[-1] -> 10J
A13: KLM | B13: 11 | C13: 12.21 | D13: 2011-11-11T00:00:00.000 | E13: 1899-12-31T11:00:00.000 | G13: =RC[-3]-RC[-5] -> 2011-10-31T00:00:00.000 | H13: =RC[-6]*RC[-5] -> 134.31 | J13: K | K13: =RC[-9]&RC[-1] -> 11K
A14: LMN | B14: 12 | C14: 13.32 | D14: 2012-12-12T00:00:00.000 | E14: 1900-01-12T00:00:00.000 | G14: =RC[-3]-RC[-5] -> 2012-11-30T00:00:00.000 | H14: =RC[-6]*RC[-5] -> 159.84 | J14: L | K14: =RC[-9]&RC[-1] -> 12L
A15: ZYX | B15: -1 | C15: -1.1100000000000001 | D15: 1999-12-01T00:00:00.000 | E15: 1899-12-31T23:00:00.000 | G15: =RC[-3]-RC[-5] -> 1999-12-02T00:00:00.000 | H15: =RC[-6]*RC[-5] -> 1.1100000000000001 | J15: M | K15: =RC[-9]&RC[-1] -> -1M